{
  "schema_version": "1.0",
  "date": "2026-08-09",
  "level": "n4",
  "level_display": "N4",
  "dataset_version": "fixture",
  "selection_version": "1",
  "word": {
    "id": "demo:学校",
    "surface": "学校",
    "reading": "がっこう",
    "ruby_segments": [
      {
        "base": "学校",
        "reading": "がっこう"
      }
    ],
    "display_gloss": "school",
    "example": {
      "ja": "毎朝歩いて学校へ行きます。",
      "en": "I walk to school every morning."
    },
    "display": {
      "word_size": "short",
      "example_size": "normal"
    }
  },
  "sequence": {
    "cycle": 0,
    "position": 42,
    "total": 650
  }
}
