{
  "schema_version": "1.0",
  "date": "2026-08-09",
  "level": "n5",
  "level_display": "N5",
  "dataset_version": "fixture",
  "selection_version": "1",
  "word": {
    "id": "demo:ありがとう",
    "surface": "ありがとう",
    "reading": "ありがとう",
    "ruby_segments": [
      {
        "base": "ありがとう",
        "reading": null
      }
    ],
    "display_gloss": "thank you",
    "example": {
      "ja": "本当にありがとう。",
      "en": "Thank you very much."
    },
    "display": {
      "word_size": "short",
      "example_size": "normal"
    }
  },
  "sequence": {
    "cycle": 0,
    "position": 42,
    "total": 650
  }
}
